{
  "schemaVersion": 1,
  "generatedAt": "2026-08-02T17:45:32.837Z",
  "upstream": {
    "ref": "release",
    "commit": "8172dcd0ee672d3cd9a5e5f7af134f91a45cd2b8",
    "version": "1.18.0"
  },
  "webRoot": "C:\\Users\\31029\\Documents\\GitHub\\stapk-termux\\build\\no-node-payload\\sillytavern-web",
  "endpoints": [
    {
      "method": "POST",
      "path": "/api/anthropic/caption-image",
      "status": "external_optional",
      "capability": "remote.caption",
      "exposure": "visible_when_configured",
      "inferredMethod": true,
      "dynamic": false,
      "sourceFiles": [
        "scripts/extensions/shared.js"
      ],
      "sourceLocations": [
        {
          "file": "scripts/extensions/shared.js",
          "line": 139,
          "expression": "/api/anthropic/caption-image"
        }
      ]
    },
    {
      "method": "POST",
      "path": "/api/assets/delete",
      "status": "unsupported_hidden",
      "capability": "excluded.extensions",
      "exposure": "hidden",
      "inferredMethod": false,
      "dynamic": false,
      "sourceFiles": [
        "scripts/extensions/assets/index.js"
      ],
      "sourceLocations": [
        {
          "file": "scripts/extensions/assets/index.js",
          "line": 433,
          "expression": "/api/assets/delete"
        }
      ]
    },
    {
      "method": "POST",
      "path": "/api/assets/download",
      "status": "unsupported_hidden",
      "capability": "excluded.extensions",
      "exposure": "hidden",
      "inferredMethod": false,
      "dynamic": false,
      "sourceFiles": [
        "scripts/extensions/assets/index.js"
      ],
      "sourceLocations": [
        {
          "file": "scripts/extensions/assets/index.js",
          "line": 390,
          "expression": "/api/assets/download"
        }
      ]
    },
    {
      "method": "POST",
      "path": "/api/assets/get",
      "status": "unsupported_hidden",
      "capability": "excluded.extensions",
      "exposure": "hidden",
      "inferredMethod": false,
      "dynamic": false,
      "sourceFiles": [
        "scripts/extensions/assets/index.js"
      ],
      "sourceLocations": [
        {
          "file": "scripts/extensions/assets/index.js",
          "line": 515,
          "expression": "/api/assets/get"
        }
      ]
    },
    {
      "method": "POST",
      "path": "/api/avatars/delete",
      "status": "implemented",
      "capability": "core.personas",
      "exposure": "visible_when_implemented",
      "inferredMethod": false,
      "dynamic": false,
      "sourceFiles": [
        "scripts/personas.js"
      ],
      "sourceLocations": [
        {
          "file": "scripts/personas.js",
          "line": 1170,
          "expression": "/api/avatars/delete"
        }
      ]
    },
    {
      "method": "POST",
      "path": "/api/avatars/get",
      "status": "implemented",
      "capability": "core.personas",
      "exposure": "visible_when_implemented",
      "inferredMethod": false,
      "dynamic": false,
      "sourceFiles": [
        "scripts/personas.js"
      ],
      "sourceLocations": [
        {
          "file": "scripts/personas.js",
          "line": 276,
          "expression": "/api/avatars/get"
        }
      ]
    },
    {
      "method": "POST",
      "path": "/api/avatars/upload",
      "status": "implemented",
      "capability": "core.personas",
      "exposure": "visible_when_implemented",
      "inferredMethod": false,
      "dynamic": false,
      "sourceFiles": [
        "scripts/personas.js"
      ],
      "sourceLocations": [
        {
          "file": "scripts/personas.js",
          "line": 370,
          "expression": "/api/avatars/upload"
        },
        {
          "file": "scripts/personas.js",
          "line": 403,
          "expression": "/api/avatars/upload"
        },
        {
          "file": "scripts/personas.js",
          "line": 2040,
          "expression": "/api/avatars/upload"
        }
      ]
    },
    {
      "method": "POST",
      "path": "/api/azure/generate",
      "status": "external_optional",
      "capability": "remote.tts",
      "exposure": "visible_when_configured",
      "inferredMethod": false,
      "dynamic": false,
      "sourceFiles": [
        "scripts/extensions/tts/azure.js"
      ],
      "sourceLocations": [
        {
          "file": "scripts/extensions/tts/azure.js",
          "line": 191,
          "expression": "/api/azure/generate"
        }
      ]
    },
    {
      "method": "POST",
      "path": "/api/azure/list",
      "status": "external_optional",
      "capability": "remote.tts",
      "exposure": "visible_when_configured",
      "inferredMethod": false,
      "dynamic": false,
      "sourceFiles": [
        "scripts/extensions/tts/azure.js"
      ],
      "sourceLocations": [
        {
          "file": "scripts/extensions/tts/azure.js",
          "line": 143,
          "expression": "/api/azure/list"
        }
      ]
    },
    {
      "method": "POST",
      "path": "/api/backends/chat-completions/bias",
      "status": "implemented",
      "capability": "core.chats",
      "exposure": "visible_when_implemented",
      "inferredMethod": false,
      "dynamic": true,
      "sourceFiles": [
        "scripts/openai.js"
      ],
      "sourceLocations": [
        {
          "file": "scripts/openai.js",
          "line": 3311,
          "expression": "/api/backends/chat-completions/bias?model=${getTokenizerModel()}"
        }
      ]
    },
    {
      "method": "POST",
      "path": "/api/backends/chat-completions/generate",
      "status": "implemented",
      "capability": "core.chats",
      "exposure": "visible_when_implemented",
      "inferredMethod": false,
      "dynamic": false,
      "sourceFiles": [
        "scripts/custom-request.js",
        "scripts/openai.js"
      ],
      "sourceLocations": [
        {
          "file": "scripts/custom-request.js",
          "line": 463,
          "expression": "/api/backends/chat-completions/generate"
        },
        {
          "file": "scripts/openai.js",
          "line": 3054,
          "expression": "/api/backends/chat-completions/generate"
        }
      ]
    },
    {
      "method": "POST",
      "path": "/api/backends/chat-completions/multimodal-models/aimlapi",
      "status": "external_optional",
      "capability": "remote.image",
      "exposure": "visible_when_configured",
      "inferredMethod": true,
      "dynamic": false,
      "sourceFiles": [
        "scripts/extensions/caption/index.js"
      ],
      "sourceLocations": [
        {
          "file": "scripts/extensions/caption/index.js",
          "line": 620,
          "expression": "/api/backends/chat-completions/multimodal-models/aimlapi"
        }
      ]
    },
    {
      "method": "POST",
      "path": "/api/backends/chat-completions/multimodal-models/chutes",
      "status": "external_optional",
      "capability": "remote.image",
      "exposure": "visible_when_configured",
      "inferredMethod": true,
      "dynamic": false,
      "sourceFiles": [
        "scripts/extensions/caption/index.js"
      ],
      "sourceLocations": [
        {
          "file": "scripts/extensions/caption/index.js",
          "line": 623,
          "expression": "/api/backends/chat-completions/multimodal-models/chutes"
        }
      ]
    },
    {
      "method": "POST",
      "path": "/api/backends/chat-completions/multimodal-models/electronhub",
      "status": "external_optional",
      "capability": "remote.image",
      "exposure": "visible_when_configured",
      "inferredMethod": true,
      "dynamic": false,
      "sourceFiles": [
        "scripts/extensions/caption/index.js"
      ],
      "sourceLocations": [
        {
          "file": "scripts/extensions/caption/index.js",
          "line": 624,
          "expression": "/api/backends/chat-completions/multimodal-models/electronhub"
        }
      ]
    },
    {
      "method": "POST",
      "path": "/api/backends/chat-completions/multimodal-models/mistral",
      "status": "external_optional",
      "capability": "remote.image",
      "exposure": "visible_when_configured",
      "inferredMethod": true,
      "dynamic": false,
      "sourceFiles": [
        "scripts/extensions/caption/index.js"
      ],
      "sourceLocations": [
        {
          "file": "scripts/extensions/caption/index.js",
          "line": 625,
          "expression": "/api/backends/chat-completions/multimodal-models/mistral"
        }
      ]
    },
    {
      "method": "POST",
      "path": "/api/backends/chat-completions/multimodal-models/moonshot",
      "status": "external_optional",
      "capability": "remote.image",
      "exposure": "visible_when_configured",
      "inferredMethod": true,
      "dynamic": false,
      "sourceFiles": [
        "scripts/extensions/caption/index.js"
      ],
      "sourceLocations": [
        {
          "file": "scripts/extensions/caption/index.js",
          "line": 627,
          "expression": "/api/backends/chat-completions/multimodal-models/moonshot"
        }
      ]
    },
    {
      "method": "POST",
      "path": "/api/backends/chat-completions/multimodal-models/nanogpt",
      "status": "external_optional",
      "capability": "remote.image",
      "exposure": "visible_when_configured",
      "inferredMethod": true,
      "dynamic": false,
      "sourceFiles": [
        "scripts/extensions/caption/index.js"
      ],
      "sourceLocations": [
        {
          "file": "scripts/extensions/caption/index.js",
          "line": 622,
          "expression": "/api/backends/chat-completions/multimodal-models/nanogpt"
        }
      ]
    },
    {
      "method": "POST",
      "path": "/api/backends/chat-completions/multimodal-models/pollinations",
      "status": "external_optional",
      "capability": "remote.image",
      "exposure": "visible_when_configured",
      "inferredMethod": true,
      "dynamic": false,
      "sourceFiles": [